{
  "$schema": "https://json-schema.org/draft/2020-12/schema",
  "$id": "https://zwhy149.github.io/bead-grid-studio/schema/palette.schema.json",
  "title": "BeadGridStudioPalette",
  "description": "JSON Schema for Bead Grid Studio open palette definitions.",
  "type": "object",
  "required": ["schemaVersion", "id", "name", "colors"],
  "properties": {
    "schemaVersion": {
      "type": "integer",
      "minimum": 1,
      "default": 1,
      "description": "Version of the palette schema format."
    },
    "id": {
      "type": "string",
      "pattern": "^[a-z0-9_.-]+$",
      "description": "Unique identifier for the palette provider."
    },
    "name": {
      "type": "string",
      "minLength": 1,
      "description": "Human-readable display name of the palette."
    },
    "manufacturer": {
      "type": "string",
      "description": "Optional manufacturer or brand name."
    },
    "source": {
      "type": "string",
      "description": "Data provenance, license, or origin repository/link."
    },
    "license": {
      "type": "string",
      "description": "License under which the color mapping data is published (e.g. MIT, CC0-1.0, Apache-2.0)."
    },
    "beadMm": {
      "type": "number",
      "exclusiveMinimum": 0,
      "description": "Nominal bead outer diameter in millimeters (e.g. 2.6 for mini beads, 5.0 for midi beads)."
    },
    "anchors": {
      "type": "object",
      "description": "Semantic anchor color codes used for background, outlines, and highlights.",
      "properties": {
        "transparent": { "type": ["string", "null"] },
        "white": { "type": ["string", "null"] },
        "black": { "type": ["string", "null"] }
      },
      "additionalProperties": false
    },
    "colors": {
      "type": "array",
      "minItems": 1,
      "description": "Ordered list of color definitions in this palette.",
      "items": {
        "type": "object",
        "required": ["code", "hex"],
        "properties": {
          "code": {
            "type": "string",
            "minLength": 1,
            "description": "Unique alphanumeric code for this color (e.g. 'A1', 'H7', '01')."
          },
          "name": {
            "type": "string",
            "description": "Localized or descriptive name of the color."
          },
          "hex": {
            "type": "string",
            "pattern": "^#[0-9A-Fa-f]{6}$",
            "description": "Standard 6-digit hex color code (#RRGGBB)."
          },
          "displayHex": {
            "type": "string",
            "pattern": "^#[0-9A-Fa-f]{6}$",
            "description": "Optional on-screen display hex override for near-white or metallic beads."
          },
          "series": {
            "type": "string",
            "description": "Optional classification series (e.g. 'A' for yellows, 'H' for neutrals)."
          },
          "isTransparent": {
            "type": "boolean",
            "default": false,
            "description": "True if this bead represents clear / transparent material excluded from automatic color matching."
          }
        },
        "additionalProperties": false
      }
    }
  },
  "additionalProperties": false
}
